[
  {
    "id": "cmd-001",
    "transcript": "افتح واتساب",
    "normalized_text": "افتح واتساب",
    "dialect": "egyptian_arabic",
    "intent": "open_app",
    "slots": {
      "app_name": "واتساب",
      "package": "com.whatsapp"
    },
    "execution": {
      "tool": "launch_app",
      "args": {
        "package": "com.whatsapp"
      }
    },
    "safety_level": "safe",
    "confirmation_policy": "auto",
    "code_switch": false,
    "negative_example": false
  },
  {
    "id": "cmd-001a",
    "transcript": "افتح الواتس",
    "normalized_text": "افتح الواتس",
    "dialect": "egyptian_arabic",
    "intent": "open_app",
    "slots": {
      "app_name": "واتساب",
      "package": "com.whatsapp"
    },
    "execution": {
      "tool": "launch_app",
      "args": {
        "package": "com.whatsapp"
      }
    },
    "safety_level": "safe",
    "confirmation_policy": "auto",
    "code_switch": false,
    "negative_example": false
  },
  {
    "id": "cmd-001b",
    "transcript": "شغل واتساب",
    "normalized_text": "شغل واتساب",
    "dialect": "egyptian_arabic",
    "intent": "open_app",
    "slots": {
      "app_name": "واتساب",
      "package": "com.whatsapp"
    },
    "execution": {
      "tool": "launch_app",
      "args": {
        "package": "com.whatsapp"
      }
    },
    "safety_level": "safe",
    "confirmation_policy": "auto",
    "code_switch": false,
    "negative_example": false
  },
  {
    "id": "cmd-001c",
    "transcript": "شغل الواتس",
    "normalized_text": "شغل الواتس",
    "dialect": "egyptian_arabic",
    "intent": "open_app",
    "slots": {
      "app_name": "واتساب",
      "package": "com.whatsapp"
    },
    "execution": {
      "tool": "launch_app",
      "args": {
        "package": "com.whatsapp"
      }
    },
    "safety_level": "safe",
    "confirmation_policy": "auto",
    "code_switch": false,
    "negative_example": false
  },
  {
    "id": "cmd-002",
    "transcript": "افتح الكاميرا",
    "normalized_text": "افتح الكاميرا",
    "dialect": "egyptian_arabic",
    "intent": "open_app",
    "slots": {
      "app_name": "الكاميرا",
      "package": "com.android.camera"
    },
    "execution": {
      "tool": "launch_app",
      "args": {
        "package": "com.android.camera"
      }
    },
    "safety_level": "safe",
    "confirmation_policy": "auto",
    "code_switch": false,
    "negative_example": false
  },
  {
    "id": "cmd-002a",
    "transcript": "شغل الكاميرا",
    "normalized_text": "شغل الكاميرا",
    "dialect": "egyptian_arabic",
    "intent": "open_app",
    "slots": {
      "app_name": "الكاميرا",
      "package": "com.android.camera"
    },
    "execution": {
      "tool": "launch_app",
      "args": {
        "package": "com.android.camera"
      }
    },
    "safety_level": "safe",
    "confirmation_policy": "auto",
    "code_switch": false,
    "negative_example": false
  },
  {
    "id": "cmd-002b",
    "transcript": "افتح الكاميرا الخلفية",
    "normalized_text": "افتح الكاميرا الخلفية",
    "dialect": "egyptian_arabic",
    "intent": "open_app",
    "slots": {
      "app_name": "الكاميرا",
      "package": "com.android.camera"
    },
    "execution": {
      "tool": "launch_app",
      "args": {
        "package": "com.android.camera"
      }
    },
    "safety_level": "safe",
    "confirmation_policy": "auto",
    "code_switch": false,
    "negative_example": false
  },
  {
    "id": "cmd-003",
    "transcript": "افتح الإعدادات",
    "normalized_text": "افتح الإعدادات",
    "dialect": "egyptian_arabic",
    "intent": "open_settings",
    "slots": {},
    "execution": {
      "tool": "open_settings",
      "args": {}
    },
    "safety_level": "safe",
    "confirmation_policy": "auto",
    "code_switch": false,
    "negative_example": false
  },
  {
    "id": "cmd-004",
    "transcript": "شغل الواي فاي",
    "normalized_text": "شغل الواي فاي",
    "dialect": "egyptian_arabic",
    "intent": "toggle_wifi",
    "slots": {
      "target_state": "on"
    },
    "execution": {
      "tool": "toggle_wifi",
      "args": {
        "state": "on"
      }
    },
    "safety_level": "safe",
    "confirmation_policy": "auto",
    "code_switch": false,
    "negative_example": false
  },
  {
    "id": "cmd-004a",
    "transcript": "شغّل الواي فاي",
    "normalized_text": "شغل الواي فاي",
    "dialect": "egyptian_arabic",
    "intent": "toggle_wifi",
    "slots": {
      "target_state": "on"
    },
    "execution": {
      "tool": "toggle_wifi",
      "args": {
        "state": "on"
      }
    },
    "safety_level": "safe",
    "confirmation_policy": "auto",
    "code_switch": false,
    "negative_example": false
  },
  {
    "id": "cmd-004b",
    "transcript": "فعّل الواي فاي",
    "normalized_text": "فعل الواي فاي",
    "dialect": "egyptian_arabic",
    "intent": "toggle_wifi",
    "slots": {
      "target_state": "on"
    },
    "execution": {
      "tool": "toggle_wifi",
      "args": {
        "state": "on"
      }
    },
    "safety_level": "safe",
    "confirmation_policy": "auto",
    "code_switch": false,
    "negative_example": false
  },
  {
    "id": "cmd-005",
    "transcript": "اقفل الواي فاي",
    "normalized_text": "اقفل الواي فاي",
    "dialect": "egyptian_arabic",
    "intent": "toggle_wifi",
    "slots": {
      "target_state": "off"
    },
    "execution": {
      "tool": "toggle_wifi",
      "args": {
        "state": "off"
      }
    },
    "safety_level": "safe",
    "confirmation_policy": "auto",
    "code_switch": false,
    "negative_example": false
  },
  {
    "id": "cmd-005a",
    "transcript": "اقطع الواي فاي",
    "normalized_text": "اقطع الواي فاي",
    "dialect": "egyptian_arabic",
    "intent": "toggle_wifi",
    "slots": {
      "target_state": "off"
    },
    "execution": {
      "tool": "toggle_wifi",
      "args": {
        "state": "off"
      }
    },
    "safety_level": "safe",
    "confirmation_policy": "auto",
    "code_switch": false,
    "negative_example": false
  },
  {
    "id": "cmd-005b",
    "transcript": "قفّل النت الواي فاي",
    "normalized_text": "قفل النت الواي فاي",
    "dialect": "egyptian_arabic",
    "intent": "toggle_wifi",
    "slots": {
      "target_state": "off"
    },
    "execution": {
      "tool": "toggle_wifi",
      "args": {
        "state": "off"
      }
    },
    "safety_level": "safe",
    "confirmation_policy": "auto",
    "code_switch": false,
    "negative_example": false
  },
  {
    "id": "cmd-006",
    "transcript": "شغل البلوتوث",
    "normalized_text": "شغل البلوتوث",
    "dialect": "egyptian_arabic",
    "intent": "toggle_bluetooth",
    "slots": {
      "target_state": "on"
    },
    "execution": {
      "tool": "toggle_bluetooth",
      "args": {
        "state": "on"
      }
    },
    "safety_level": "safe",
    "confirmation_policy": "auto",
    "code_switch": false,
    "negative_example": false
  },
  {
    "id": "cmd-007",
    "transcript": "اقفل البلوتوث",
    "normalized_text": "اقفل البلوتوث",
    "dialect": "egyptian_arabic",
    "intent": "toggle_bluetooth",
    "slots": {
      "target_state": "off"
    },
    "execution": {
      "tool": "toggle_bluetooth",
      "args": {
        "state": "off"
      }
    },
    "safety_level": "safe",
    "confirmation_policy": "auto",
    "code_switch": false,
    "negative_example": false
  },
  {
    "id": "cmd-008",
    "transcript": "علّي السطوع",
    "normalized_text": "علي السطوع",
    "dialect": "egyptian_arabic",
    "intent": "set_brightness",
    "slots": {
      "direction": "up"
    },
    "execution": {
      "tool": "adjust_brightness",
      "args": {
        "direction": "up"
      }
    },
    "safety_level": "safe",
    "confirmation_policy": "auto",
    "code_switch": false,
    "negative_example": false
  },
  {
    "id": "cmd-009",
    "transcript": "قلّل السطوع",
    "normalized_text": "قلل السطوع",
    "dialect": "egyptian_arabic",
    "intent": "set_brightness",
    "slots": {
      "direction": "down"
    },
    "execution": {
      "tool": "adjust_brightness",
      "args": {
        "direction": "down"
      }
    },
    "safety_level": "safe",
    "confirmation_policy": "auto",
    "code_switch": false,
    "negative_example": false
  },
  {
    "id": "cmd-010",
    "transcript": "علّي الصوت",
    "normalized_text": "علي الصوت",
    "dialect": "egyptian_arabic",
    "intent": "volume_up",
    "slots": {},
    "execution": {
      "tool": "adjust_volume",
      "args": {
        "direction": "up"
      }
    },
    "safety_level": "safe",
    "confirmation_policy": "auto",
    "code_switch": false,
    "negative_example": false
  },
  {
    "id": "cmd-010a",
    "transcript": "زود الصوت",
    "normalized_text": "زود الصوت",
    "dialect": "egyptian_arabic",
    "intent": "volume_up",
    "slots": {},
    "execution": {
      "tool": "adjust_volume",
      "args": {
        "direction": "up"
      }
    },
    "safety_level": "safe",
    "confirmation_policy": "auto",
    "code_switch": false,
    "negative_example": false
  },
  {
    "id": "cmd-010b",
    "transcript": "خلي الصوت أعلى",
    "normalized_text": "خلي الصوت اعلي",
    "dialect": "egyptian_arabic",
    "intent": "volume_up",
    "slots": {},
    "execution": {
      "tool": "adjust_volume",
      "args": {
        "direction": "up"
      }
    },
    "safety_level": "safe",
    "confirmation_policy": "auto",
    "code_switch": false,
    "negative_example": false
  },
  {
    "id": "cmd-011",
    "transcript": "وطّي الصوت",
    "normalized_text": "وطي الصوت",
    "dialect": "egyptian_arabic",
    "intent": "volume_down",
    "slots": {},
    "execution": {
      "tool": "adjust_volume",
      "args": {
        "direction": "down"
      }
    },
    "safety_level": "safe",
    "confirmation_policy": "auto",
    "code_switch": false,
    "negative_example": false
  },
  {
    "id": "cmd-011a",
    "transcript": "قلل الصوت",
    "normalized_text": "قلل الصوت",
    "dialect": "egyptian_arabic",
    "intent": "volume_down",
    "slots": {},